{
  "schema": "8x8.node-consent.v0.1",
  "consent_id": "CONSENT.example.cpu.20260801",
  "node_id": "NODE.example.public",
  "resource_class": "CPU",
  "purpose": "Run a deterministic public protocol conformance fixture.",
  "workload_classes": ["PUBLIC_CONFORMANCE_TEST"],
  "issued_at": "2026-08-01T22:58:00Z",
  "activates_at": "2026-08-01T22:58:00Z",
  "expires_at": "2026-08-02T22:58:00Z",
  "revoked_at": null,
  "status": "ACTIVE",
  "limits": {
    "max_duration_seconds": 60,
    "max_cpu_percent": 10,
    "max_gpu_percent": null,
    "max_storage_bytes": 1048576,
    "max_upload_bytes": 0,
    "max_download_bytes": 0,
    "minimum_battery_percent": null,
    "maximum_temperature_celsius": 70,
    "schedule": "single conformance run",
    "network_policy": "OFFLINE_ONLY"
  },
  "allowed_coordinators": ["8x8.protocol.fixture"],
  "allowed_destinations": [],
  "data_classification": "NO_USER_DATA",
  "retention_seconds": 0,
  "reward_participation": "SIMULATED",
  "secret_reference_ids": [],
  "local_pause_required": true,
  "kill_switch_required": true,
  "policy_digest": "aaaaaaaaaaaaaaaaaaaaaaaaaaaaaaaaaaaaaaaaaaaaaaaaaaaaaaaaaaaaaaaa",
  "receipt_sink": "local-fixture-output",
  "user_approval_receipt": "fixture-only-not-user-approval"
}
